questao,alternativa_E,alternativa_D,alternativaCorreta,alternativa_A,texto,alternativa_C,alternativa_B,pergunta
Questão 11454.   Biologia - Nível Superior - SAAE SP - VUNESP - 2014,"e) não são conclusivas, pois o tempo do estudo abrange apenas um período reprodutivo completo.","d) não são conclusivas, pois a presença de ninhos e filho­tes não indica capacidade reprodutiva.
",'e',"a) são conclusivas, pois o tempo do estudo abrange um período reprodutivo completo.
",,"c) são conclusivas, pois a ocorrência de animais juvenis e adultos ao longo de toda extensão indica capacidade adaptativa.
","b) são conclusivas, pois a ocorrência de ninhos, filhotes e adultos demonstra capacidade adaptativa e reprodutiva.
","Estudos de ocorrência e distribuição de duas populações de jacarés foram realizados ao longo de um ano após o enchi­mento de um grande reservatório de água.

Verificou­-se a ocorrência de ninhos e filhotes de ambas espé­cies nas margens do reservatório, assim como a presença de animais juvenis e adultos em praticamente toda a extensão do reservatório.

Tais observações"
Questão 10147.   Biologia - Nível Superior - SEE AL - CESPE - 2013,,,'b',Certo,,,Errado,"A alfarroba é uma vagem da qual se extrai uma polpa que, depois de torrada e moída, pode ser usada como substituto do cacau. Com sabor de chocolate, os produtos feitos com alfarroba possuem o benefício de serem isentos de lactose, glúten e açúcar, embora, em termos calóricos, não apresentem muita diferença do cacau. A alfarrobeira (Ceratonia siliqua) também é designada pelo nome popular de figueira-do-egito.

Internet: < www.senado.gov.br/ > (com adaptações).

Com base nas informações apresentadas no texto e nos aspectos a ele relacionados, julgue os itens a seguir.

De acordo com a classificação biológica proposta por Margulis, plantas e algas pluricelulares são classificadas no Reino Metaphyta (Plantae)."
Questão 10136.   Biologia - Nível Superior - SEE AL - CESPE - 2013,,,'b',Certo,,,Errado,"Em 1977, o cientista norte-americano Carl Woese revolucionou a árvore da vida, diagrama que representa a relação evolutiva entre as espécies, ao propor um novo domínio, os Archaea. Pensava-se que esse conjunto de espécies eram bactérias, mas C. Woese mostrou que é um grupo independente e, a nível evolutivo, tão próximo da bactéria Escherichia coli como de um cogumelo ou de um pinguim. C. Woese considerou, em seus estudos, o sequenciamento do RNA ribossomal dos seres vivos.

Internet: < www.publico.pt > (com adaptações).

Com base no texto acima, julgue os próximos itens.

Archaeas são ancestrais das atuais bactérias e, por serem espécies antigas, estão adaptadas a diversos ambientes inóspitos."
Questão 11447.   Biologia - Nível Superior - SAAE SP - VUNESP - 2014,"e) necessita ser transcrito, ou em DNA ou RNAm, para que ocorra a tradução.","d) atua como RNAm no processo de tradução, em todos os grupos.
",'b',"a) se organiza na forma de fita simples, apenas.
",,"c) atua como fita molde para a transcrição reversa, apenas.
","b) se organiza tanto em fita simples como fita dupla, depen­dendo do grupo.","O grupo dos vírus é bastante heterogêneo, tanto por sua composição biomolecular externa como interna.

Nos grupos de vírus que apresentam RNA como material genético, tal ácido nucleico"
Questão 10148.   Biologia - Nível Superior - SEE AL - CESPE - 2013,,,'a',Certo,,,Errado,"A alfarroba é uma vagem da qual se extrai uma polpa que, depois de torrada e moída, pode ser usada como substituto do cacau. Com sabor de chocolate, os produtos feitos com alfarroba possuem o benefício de serem isentos de lactose, glúten e açúcar, embora, em termos calóricos, não apresentem muita diferença do cacau. A alfarrobeira (Ceratonia siliqua) também é designada pelo nome popular de figueira-do-egito.

Internet: < www.senado.gov.br/ > (com adaptações).

Com base nas informações apresentadas no texto e nos aspectos a ele relacionados, julgue os itens a seguir.

A alfarrobeira é uma planta que, durante o ciclo reprodutivo, apresenta formação de flores e frutos."
Questão 16530.   Biologia - Nível Médio - Bombeiro Militar MG - IDECAN - 2015,,d) Sobrecarga toxicológica.,'c',a) Efeito estufa.,,c) Magnificação trófica.,b) Eutrofização trófica.,"Devido à redução da biomassa na passagem de um nível trófico para outro, a concentração do produto tóxico aumenta nos organismos ao longo da cadeia e os organismos dos últimos níveis tróficos acabam absorvendo doses altas dessas substâncias prejudiciais à saúde. É correto afirmar que o fenômeno descrito é conhecido como:"
Questão 10159.   Biologia - Nível Superior - SEE AL - CESPE - 2013,,,'b',Certo,,,Errado,"Acerca da estrutura e do funcionamento do sistema nervoso humano, julgue os itens que se seguem.

Do ponto de vista eletroquímico, o processamento de informações no sistema nervoso depende da ocorrência de potenciais de ação."
Questão 11455.   Biologia - Nível Superior - SAAE SP - VUNESP - 2014,e) exsicatas,d) viveiros,'c',a) xilotecas,,c) herbários,b) carpotecas,"A coleta e preservação de amostras vegetais é uma prática recomendável de levantamento florístico em ambientes alterados, por ação antrópica, em grandes empreendimentos geradores de impacto ambiental.

As coleções botânicas formadas por material vegetal devidamente preservado, constituído por ramos terminais compostos por folhas jovens e adultas, botões florais e flores, são denominadas"
Questão 14303.   Biologia - Nível Superior - UFRN - BD - 2015,,"d) os pigmentos, clorofilas b e c, que têm papel fotossintético e são encontrados em diatomáceas e plantas, respectivamente.",'c',"a) as clorofilas do tipo clorobium, que se encontra em abundância nas cianobactérias e algas pardas.",,"c) os carotenoides, que desempenham função antioxidante para a célula e podem estar presentes em folhas verdes.","b) as ficobilinas, que são pigmentos lipossolúveis e ocorrem nas bactérias verdes sulfurosas.","A energia luminosa pode ser captada por diversos pigmentos celulares, tais como:"
Questão 10103.   Biologia - Nível Médio - SEE AC - FUNCAB - 2010,e) na falta de combate aos insetos vetores que estão aumentando em quantidade devido ao aquecimento global.,"d) na falta de investimentos em pesquisa, já que a vacina BCG não é mais apropriada para controle e prevenção da doença.",'c',"a) na falta de saneamento básico emtais regiões, já que nesses lugares o esgoto é lançado diretamente em rios, acarretando numa contaminação maior dos moradores.
",,"c) na falta de um planejamento urbano, já que o processo de favelização com a construção de casas sem ventilação, é um fator que contribui para a disseminação da doença.
","b) na falta de um programa de saúde pública adequado, já que os medicamentos para o 
tratamento da tuberculose não são disponibilizados pelo governo.
","O programa Saúde, Mitos e Verdades trata da tuberculose que, segundo a Organização Mundial da Saúde  OMS, é considerada uma doença de emergência mundial, ligada a questões sociais e de grande incidência nas regiões mais pobres, embora desde o aparecimento da AIDS, venha aumentando também nos países desenvolvidos. Cerca de 3 milhões de pessoas morrem anualmente, vítimas da tuberculose e 9 milhões de casos são registrados todos os anos. Trata-se de uma doença altamente contagiosa. Atinge todas as faixas etárias e é de extrema importância na área da saúde pública... (Disponível em www.rtv.unicamp.br/saude)
Segundo o texto, as questões sociais estão relacionadas ao índice de tuberculose em regiões pobres.Tal fato é observado:"
Questão 25068.   Biologia - Nível Médio - ENEM - INEP - 2014,e) Liberação de auxinas que estimulam o crescimento do tomateiro,d) Liberação de substâncias que inibem o crescimento do fungo.,'c',a) Fixação de nitrogênio para o tomateiro.,,c) Diminuição da quantidade de ferro disponível para o fungo.,b) Disponibilização de cálcio para o tomateiro,"Existem bactérias que inibem o crescimento de um fungo causador de doenças no tomateiro, por consumirem o ferro disponível no meio. As bactérias também fazem fixação de nitrogênio, disponibilizam cálcio e produzem auxinas, substâncias que estimulam diretamente o crescimento do tomateiro.

PELZER , G. Q. et al. Mecanismos de controle da murcha-de-esclerócio e promoção de crescimento em tomateiro mediados por rizobactérias.Tropical Plant Pathology, v. 36, n. 2, mar.-abr. 2011 (adaptado).

Qual dos processos biológicos mencionados indica uma relação ecológica de competição?"
Questão 25224.   Biologia - Nível Médio - UFF - UFF - 2010,"e) microcrustáceos, algas, protozoários e pequenos anelídeos.","d) caranguejos, siris, sardinhas e tainhas.",'e',"a) esponjas, ouriços-do-mar, estrelas-do-mar e tainhas.",,"c) tainhas, arraias, tartarugas e robalos.","b) sardinhas, caranguejos, ostras e caravelas.","Podendo chegar até vinte metros de comprimento, o tubarão-baleia é o maior representante dos peixes.
Qualquer criatura marinha com esse tamanho é normalmente muito temida, mas por causa de sua dieta basicamente planctônica ele não oferece ameaça ao homem. Entretanto, outros membros de sua superordem já causaram acidentes a vários banhistas nas praias.

Com relação à dieta do tubarão-baleia, pode-se afirmar que ele come, principalmente:"
Questão 11461.   Biologia - Nível Superior - SAAE SP - VUNESP - 2014,e) menor mortalidade por predação dos indivíduos juvenis.,"d) menor risco ambiental por ação da seleção natural.
",'a',"a) maior fluxo gênico entre seus integrantes populacionais.
",,"c) maior adaptabilidade por meio da especiação.
","b) maior deriva genética entre os indivíduos remanescentes.
","A interligação de fragmentos florestais nativos por meio das matas ciliares recuperadas é uma prática conservacionista da biodiversidade da herpetofauna, pois propicia"
Questão 10150.   Biologia - Nível Superior - SEE AL - CESPE - 2013,,,'b',Certo,,,Errado,"Com relação à fotossíntese, julgue os itens subsecutivos.
Nas células vegetais, a oxidação de carboidratos para a liberação de energia ocorre nos cloroplastos."
Questão 10151.   Biologia - Nível Superior - SEE AL - CESPE - 2013,,,'b',Certo,,,Errado,"Com relação à fotossíntese, julgue os itens subsecutivos.
Na fotossíntese, a quebra das moléculas de CO2 permite a liberação de átomos de oxigênio que, por meio de ligações covalentes, formam O2."
Questão 10176.   Biologia - Nível Superior - SEE AL - CESPE - 2013,,,'b',Certo," De acordo com a Convenção sobre Diversidade Biológica (CDB), espécie exótica é toda espécie que se encontra fora de sua área de distribuição natural e espécie exótica invasora é aquela que, além de estar fora da sua área de distribuição natural, ainda ameaça ecossistemas, hábitats ou outras espécies. Estas espécies, devido às suas vantagens competitivas e favorecidas pela ausência de inimigos naturais, podem proliferar e invadir ecossistemas, sejam eles naturais ou antropizados. Espécies exóticas invasoras representam uma das maiores ameaças ao meio ambiente, pois causam enormes prejuízos à economia, à biodiversidade, aos ecossistemas naturais e à saúde humana, sendo consideradas a segunda maior causa de perda de biodiversidade, logo após a degradação e a fragmentação de hábitats.

Internet: < http:www.mma.gov.br > (com adaptações).

Tendo o texto acima como referência inicial, julgue os próximos itens",,Errado,"Sabendo que o mexilhão-zebra é uma espécie exótica invasora que acumula metais pesados em seu organismo, é correto afirmar que há uma concentração maior de metais pesados no nível trófico que antecede esse animal em uma cadeia alimentar.

"
Questão 6170.   Biologia - Nível Médio - Polícia Civil SP - VUNESP - 2012,e) a traqueia e os pulmões.,d) o palato e a orofaringe.,'a',a) a base da língua e a traqueia.,,c) a faringe e a epiglote.,b) a base da língua e o esôfago.,"A laringe é uma estrutura tubular, componente do sistema
respiratório, formada principalmente por músculos e cartilagens.
É correto afirmar que a laringe está localizada entre
"
Questão 17561.   Biologia - Nível Superior - Polícia Militar MT - UNEMAT - 2012,"e) Diferentemente das microalgas, gimnospermas e angiospermas não são organismos autótrofos.",d) A luz solar que atravessa a camada de gelo é captada por leucoplastos para a realização da fotossíntese.,'b',a) As microalgas que compõem o fitoplâncton dão pequena contribuição na liberação de oxigênio na água e na atmosfera.,,c) As microalgas são organismos tipicamente heterótrofos e procariontes.,"b) A elevada produção fotossintética no local pode ser verificada pela coloração verde do mar, uma vez que essas algas possuem cloroplastos.","Espacial Americana, descobriram sob geleiras do Mar Ártico o que pode ser a maior concentração de microalgas do planeta. O excesso de fitoplâncton nesse local torna o mar verde, e chega a ser quatro vezes mais abundante em comparação com o mar azul. Acredita-se que devido ao degelo na região, a camada de gelo superficial tem se tornado cada vez mais fina, permitindo a passagem da luz solar, essencial para a sobrevivência e reprodução desses seres vivos.

Sobre este assunto, assinale a alternativa correta."
Questão 10159.   Biologia - Nível Superior - SEE AL - CESPE - 2013,,,'b',Certo,,,Errado,"Acerca da estrutura e do funcionamento do sistema nervoso humano, julgue os itens que se seguem.

Do ponto de vista eletroquímico, o processamento de informações no sistema nervoso depende da ocorrência de potenciais de ação."
Questão 18242.   Biologia - Nível Médio - Polícia Militar PR - UFPR - 2014,e) no controle de pragas e na polinização.,d) no controle de pragas e na dispersão das sementes.,'a',a) na dispersão das sementes e na polinização.,,c) na polinização e na dispersão das sementes.,b) na dispersão das sementes e no controle de pragas.,"O processo de desaparecimento de animais em um ambiente, conhecido por defaunação, pode causar um dano profundo aos ecossistemas. Em florestas tropicais, muitas árvores dependem de animais como macacos e antas. Na agricultura, a produção de muitas culturas depende das abelhas, que estão desaparecendo. Os animais citados no texto, mamíferos e abelhas, atuam, respectivamente,"
Questão 11452.   Biologia - Nível Superior - SAAE SP - VUNESP - 2014,e) produzida pelo organismo humano em decorrência da exposição de agentes microbianos contaminantes.,d) utilizada como controle na avaliação de contaminação ambiental por metais pesados descartados indevida­mente no ambiente.,'a',"a) mensurada nos fluidos como sangue ou urina, tecidos ou ar exalado, capaz de avaliar a intensidade da exposi­ção e o risco à saúde.",,"c) gerada especificamente por processos industriais quí­micos e capaz de causar contaminação, humana ou ani­mal, em larga escala.","b) tóxica, potencialmente cancerígena, presente nos ambientes naturais utilizados como mananciais para captação hidríca.","Dentro da prática de monitoramento ambiental para a saúde da população, utilizam-­se os indicadores biológicos de exposição efeito (IBE), compreendidos como toda substância"
Questão 10174.   Biologia - Nível Superior - SEE AL - CESPE - 2013,,,'a',Certo," De acordo com a Convenção sobre Diversidade Biológica (CDB), espécie exótica é toda espécie que se encontra fora de sua área de distribuição natural e espécie exótica invasora é aquela que, além de estar fora da sua área de distribuição natural, ainda ameaça ecossistemas, hábitats ou outras espécies. Estas espécies, devido às suas vantagens competitivas e favorecidas pela ausência de inimigos naturais, podem proliferar e invadir ecossistemas, sejam eles naturais ou antropizados. Espécies exóticas invasoras representam uma das maiores ameaças ao meio ambiente, pois causam enormes prejuízos à economia, à biodiversidade, aos ecossistemas naturais e à saúde humana, sendo consideradas a segunda maior causa de perda de biodiversidade, logo após a degradação e a fragmentação de hábitats.

Internet: < http:www.mma.gov.br > (com adaptações).

Tendo o texto acima como referência inicial, julgue os próximos itens",,Errado,"A poluição constitui ameaça à biodiversidade por comprometer a capacidade de sobrevivência ou de reprodução de determinada espécie em seu hábitat. O aumento, com causas antrópicas, da temperatura da água de um rio é, portanto, um exemplo de poluição.

"
Questão 11451.   Biologia - Nível Superior - SAAE SP - VUNESP - 2014,"e) plenamente satisfatórios, para o conhecimento dos impactos ambientais existentes.","d) muito satisfatórios, por indicarem os principais fatores de desequilíbrio ambiental.
",'b',"a) insatisfatórios, por não indicar nenhum parâmetro rele­vante de qualidade ambiental.
",,"c) satisfatórios, pois tais fatores apresentam baixa varia­ção sazonal.
","b) pouco satisfatórios, pois retratam apenas um momento do ambiente estudado.
","Metodologias de diagnósticos e monitoramento dos ecossis­temas aquáticos e de seus recursos hídricos, baseados em uma análise pontual de parâmetros físicos, químicos e bacte­riológicos, são considerados"
Questão 10133.   Biologia - Nível Superior - SEE AL - CESPE - 2013,,,'a',Certo,,,Errado,"Do ponto de vista metabólico, o cérebro humano é um órgão dispendioso, pois ele é o responsável por 20% do gasto total de energia, embora represente apenas 2% do peso total do corpo. A evolução para cérebros cada vez maiores é uma tendência marcante em toda a ordem dos primatas, o que culminou na espécie humana, cujo cérebro tem um volume desproporcional em relação ao tamanho do corpo.

F.M. Salzano. DNA: e eu com isso?
Oficina de textos, 2005 (com adaptações).

Tendo o texto acima como referência inicial e considerando os múltiplos aspectos que ele suscita, julgue os itens que se seguem.

Considerando-se o conceito de ancestralidade comum, que é um pressuposto da teoria darwinista, é correto afirmar que os seres humanos compartilham ancestrais com chimpanzés, gorilas e orangotangos."
Questão 11458.   Biologia - Nível Superior - SAAE SP - VUNESP - 2014,e) restringir-­se ao nível trófico consumidor.,d) ocorrer ao longo de todos seus integrantes.,'d',a) restringir-­se aos níveis tróficos superiores.,,c) restringir-­se aos animais insetívoros.,b) ocorrer a partir do nível trófico herbívoro.,"O DDT (dicloro  difenil  tricloro  etano) é um composto químico cujo custo de produção é baixo, além de ser altamente efecaz no combate aos insetos, às pragas e aos transmissores de doenças.

Considerado o primeiro pesticida moderno, o DDT atual­mente é proibido em diversos países, em função de sua característica acumulativa na cadeia alimentar"
Questão 17565.   Biologia - Nível Superior - Polícia Militar MT - UNEMAT - 2012,"e) A planta possui mais auxina no lado claro, apresentando fototropismo negativo.","d) A planta possui mais auxina no lado escuro, apresentando fototropismo positivo.",'d',"a) A planta possui mais auxina no lado claro, apresentando fototropismo positivo.",,"c) Isso ocorreu ao acaso, porque o crescimento das plantas não responde a estímulos luminosos.","b) A planta produziu giberilina, que promoveu a curvatura do seu caule em direção à luz.","Um aluno do segundo ciclo do Ensino Fundamental depositou uma semente de feijão em um chumaço de algodão embebido em água, dentro de um copo plástico descartável de cafezinho, a pedido da professora de Ciências. Ao observar o crescimento da planta, ficou curioso, e fez a você a seguinte pergunta: Você poderia me explicar por que a planta, que estava em uma prateleira da estante, à medida que crescia, começou a se curvar em direção à única janela da sala?

A fim de explicar o fenômeno ao aluno, utilizando seus conhecimentos de botânica, assinale a alternativa correta."
Questão 17562.   Biologia - Nível Superior - Polícia Militar MT - UNEMAT - 2012,"e) Aves apresentam pele com muitas glândulas, coração tricavitário e respiração pulmonar.",d) Mamíferos prototérios (monotremados) são vivíparos placentários.,'a',"a) Lagartos, serpentes, crocodilianos e aves apresentam diversas adaptações ao ambiente terrestre, como a excreção de ácido úrico e ovos amnióticos.",,c) Peixes cartilaginosos apresentam brânquias protegidas por opérculo e bexiga natatória.,b) Anfíbios são animais que apresentam pele lisa sem glândulas e coração tetracavitário.,"Didaticamente, os animais são divididos em dois grupos: Invertebrados e Vertebrados.

Com relação aos animais vertebrados, assinale a alternativa correta"
Questão 12396.   Biologia - Nível Superior - SEGPLAN GO - FUNIVERSA - 2015,e) Cromossomo Y,d) RNA mensageiro,'b',a) DNA nuclear,,c) RNA,b) DNA mitocondrial,Assinale a alternativa que apresenta a molécula que permite o reconhecimento de uma linhagem materna por meio do emprego de técnicas de identificação humana.
Questão 18243.   Biologia - Nível Médio - Polícia Militar PR - UFPR - 2014,"e) As afirmativas 1, 2 e 3 são verdadeiras.",d) Somente as afirmativas 2 e 3 são verdadeiras.,'e',a) Somente a afirmativa 1 é verdadeira,,c) Somente as afirmativas 1 e 3 são verdadeiras.,b) Somente as afirmativas 1 e 2 são verdadeiras.,"Durante décadas, seres parasitas foram omitidos das teias alimentares, com base na ideia de que eles teriam pouca influência na biomassa do ecossistema. Entretanto, quando a biomassa dos parasitas é medida, esta noção é desafiada. Em alguns sistemas estuarinos, por exemplo, a biomassa dos parasitas é comparável à dos predadores no topo da cadeia.

Traduzido e adaptado de: PRESTON, D. & JOHNSON, P. Ecological Consequences of Parasitism. Nature Education Knowledge 3(10):47, 2010.

A respeito da inserção dos parasitas nas teias alimentares, considere as seguintes afirmativas:

1. Parasitas podem regular o tamanho da população de hospedeiros.
2. Parasitas podem atuar como presas.
3. Parasitas podem alterar o desfecho de interações competitivas interespecíficas.

Assinale a alternativa correta"
Questão 16288.   Biologia - Nível Médio - Bombeiro Militar DF - CESPE - 2011,,,'a',Certo," Uma das muitas atribuições do corpo de bombeiros tem sido o combate a incêndios na vegetação nativa. No planalto central brasileiro, em vista do período de seca sazonal, os incêndios são preocupação constante devido ao potencial de resultar em degradação do bioma dessa região. A respeito desse tema e do bioma em questão, julgue os itens de 61 a 68.",,Errado,"Queimadas e desmatamentos constituem espécies de poluição do solo.
"
Questão 10163.   Biologia - Nível Superior - SEE AL - CESPE - 2013,,,'a',Certo," As doenças metabólicas hereditárias (DMH) são causadas por erros inatos do metabolismo (EIM) e resultam da falta de atividade de enzimas específicas ou defeitos no transporte de proteínas. Atualmente, são conhecidas mais de quinhentas doenças humanas causadas por EIM. As DMH são doenças genéticas raras que afetam diretamente o metabolismo e, frequentemente, prejudicam o crescimento e o desenvolvimento de crianças e o desempenho normal de adultos de qualquer idade. Algumas delas têm tratamento efetivo por meio de terapia de reposição enzimática, terapia nutricional específica ou suplementação de vitaminas, portanto o diagnóstico deve ser precoce.

Internet: < www.unifesp.br > (com adaptações).

Considerando as informações apresentadas no texto, julgue os itens seguintes, acerca da transmissão de características hereditárias.",,Errado,"Caso duas anomalias autossômicas recessivas se segreguem de forma independente, a probabilidade de um casal de heterozigotos para ambas as anomalias ter uma criança com uma ou outra anomalia corresponde a 7/16.
"
Questão 16286.   Biologia - Nível Médio - Bombeiro Militar DF - CESPE - 2011,,,'b',Certo," Uma das muitas atribuições do corpo de bombeiros tem sido o combate a incêndios na vegetação nativa. No planalto central brasileiro, em vista do período de seca sazonal, os incêndios são preocupação constante devido ao potencial de resultar em degradação do bioma dessa região. A respeito desse tema e do bioma em questão, julgue os itens de 61 a 68.",,Errado,"O citado bioma é o bioma caatinga.
"
Questão 12398.   Biologia - Nível Superior - SEGPLAN GO - FUNIVERSA - 2015,e) Umas das funções que a IgE exerce na resposta imune humoral são promover vasoconstrição e impedir a reação inflamatória e a passagem de outros anticorpos para o local da lesão.,"d) Durante a gestação humana, o anticorpo que confere proteção ao feto, podendo ser transportado através da placenta para a circulação do feto é o da classe IgM.",'c',"a) Os primeiros anticorpos, de baixa afinidade, a serem produzidos em uma resposta imune humoral são sempre os da classe IgG.",,"c) A IgA é a principal imunoglobulina presente na saliva, no muco, no suor, no suco gástrico, nas lágrimas e no leite.
","b) IgA é a principal molécula de anticorpo presente no sangue e em demais fluidos extracelulares.
","Acerca da resposta imunológica mediada por anticorpos, assinale a alternativa correta."
