questao,alternativa_E,alternativa_D,alternativaCorreta,alternativa_A,texto,alternativa_C,alternativa_B,pergunta
Questão 25121.   Biologia - Nível Médio - USP - FUVEST - 2015,e) arroz e feijão.,d) frango assado.,'e',a) contrafilé na brasa.,,c) ovo frito.,b) camarão na chapa.,"Alimentos de origem vegetal e animal fornecem nutrientes utilizados pelo nosso organismo para a obtenção de energia e para a síntese de moléculas. Após determinada refeição, completadas a digestão e a absorção, o nutriente majoritariamente absorvido foi a glicose. Considerando as alternativas abaixo, é correto afirmar que essa refeição estava constituída de"
Questão 10149.   Biologia - Nível Superior - SEE AL - CESPE - 2013,,,'b',Certo,,,Errado,"Com relação à fotossíntese, julgue os itens subsecutivos.
Organismos autotróficos são aqueles que dependem da energia luminosa para a produção de moléculas orgânicas alimentícias."
Questão 10168.   Biologia - Nível Superior - SEE AL - CESPE - 2013,,,'b',Certo," As doenças metabólicas hereditárias (DMH) são causadas por erros inatos do metabolismo (EIM) e resultam da falta de atividade de enzimas específicas ou defeitos no transporte de proteínas. Atualmente, são conhecidas mais de quinhentas doenças humanas causadas por EIM. As DMH são doenças genéticas raras que afetam diretamente o metabolismo e, frequentemente, prejudicam o crescimento e o desenvolvimento de crianças e o desempenho normal de adultos de qualquer idade. Algumas delas têm tratamento efetivo por meio de terapia de reposição enzimática, terapia nutricional específica ou suplementação de vitaminas, portanto o diagnóstico deve ser precoce.

Internet: < www.unifesp.br > (com adaptações).

Considerando as informações apresentadas no texto, julgue os itens seguintes, acerca da transmissão de características hereditárias.",,Errado,"De acordo com o pensamento mendeliano, os descendentes são formados por uma mistura de fatores oriundos de cada um dos genitores e, nessa mistura, os fatores modificam suas propriedades.

"
Questão 24958.   Biologia - Nível Médio - ENEM - INEP - 2015,e) manutenção do fluxo gênico entre as raças.,d) seleção natural que ocorre entre as raças.,'e',a) oscilação genética das raças.,,c) isolamento geográfico entre as raças.,b) convergência adaptativa das raças.,"Algumas raças de cães domésticos não conseguem copular entre si devido à grande diferença em seus tamanhos corporais. Ainda assim, tal dificuldade reprodutiva não ocasiona a formação de novas espécies (especiação).

Essa especiação não ocorre devido ao(à)"
Questão 10164.   Biologia - Nível Superior - SEE AL - CESPE - 2013,,,'b',Certo," As doenças metabólicas hereditárias (DMH) são causadas por erros inatos do metabolismo (EIM) e resultam da falta de atividade de enzimas específicas ou defeitos no transporte de proteínas. Atualmente, são conhecidas mais de quinhentas doenças humanas causadas por EIM. As DMH são doenças genéticas raras que afetam diretamente o metabolismo e, frequentemente, prejudicam o crescimento e o desenvolvimento de crianças e o desempenho normal de adultos de qualquer idade. Algumas delas têm tratamento efetivo por meio de terapia de reposição enzimática, terapia nutricional específica ou suplementação de vitaminas, portanto o diagnóstico deve ser precoce.

Internet: < www.unifesp.br > (com adaptações).

Considerando as informações apresentadas no texto, julgue os itens seguintes, acerca da transmissão de características hereditárias.",,Errado,"O diagnóstico de doenças metabólicas humanas deve ser precoce, porém não pode ser feito no momento do teste do pezinho, pois o genoma do recém-nascido ainda não está completamente consolidado.

"
Questão 10161.   Biologia - Nível Superior - SEE AL - CESPE - 2013,,,'b',Certo,,,Errado,"Acerca da estrutura e do funcionamento do sistema nervoso humano, julgue os itens que se seguem.

As diferentes frequências de ondas eletromagnéticas que atingem os olhos são captadas e transformadas em cores nos bastonetes da retina."
Questão 6165.   Biologia - Nível Médio - Polícia Civil SP - VUNESP - 2012,e) promove a condensação cromossômica.,d) apresenta RNA ribossômico que integrará os ribossomos.,'d',a) controla a duplicação da molécula de DNA.,,c) forma os poros do envoltório nuclear.,b) sintetiza moléculas de ATP.,"Considerando uma célula eucariótica, pode-se afirmar corretamente
que o nucléolo
"
Questão 6165.   Biologia - Nível Médio - Polícia Civil SP - VUNESP - 2012,e) promove a condensação cromossômica.,d) apresenta RNA ribossômico que integrará os ribossomos.,'d',a) controla a duplicação da molécula de DNA.,,c) forma os poros do envoltório nuclear.,b) sintetiza moléculas de ATP.,"Considerando uma célula eucariótica, pode-se afirmar corretamente
que o nucléolo
"
Questão 16287.   Biologia - Nível Médio - Bombeiro Militar DF - CESPE - 2011,,,'a',Certo," Uma das muitas atribuições do corpo de bombeiros tem sido o combate a incêndios na vegetação nativa. No planalto central brasileiro, em vista do período de seca sazonal, os incêndios são preocupação constante devido ao potencial de resultar em degradação do bioma dessa região. A respeito desse tema e do bioma em questão, julgue os itens de 61 a 68.",,Errado,"Durante os incêndios, o ciclo do carbono é movimentado pela liberação desse elemento do estoque de biomassa para a atmosfera.
"
Questão 10154.   Biologia - Nível Superior - SEE AL - CESPE - 2013,,,'a',Certo,,,Errado,"Com relação às estruturas, processos e funções dos constituintes celulares, julgue os itens subsequentes.

A membrana plasmática e a membrana mitocondrial apresentam constituição bioquímica semelhante, sendo proteínas e lipídios as moléculas orgânicas predominantes."
Questão 25123.   Biologia - Nível Médio - USP - FUVEST - 2015,e) são comensais.,d) realizam competição intraespecífica.,'c',a) disputam o mesmo nicho ecológico.,,c) compartilham o mesmo hábitat.,b) constituem uma população.,"A cobra-coral - Erythrolamprus aesculapii - tem hábito diurno, alimenta se de outras cobras e é terrícola, ou seja, caça e se abriga no chão. A jararaca - Bothrops jararaca - tem hábito noturno, alimenta-se de mamíferos e é terrícola. Ambas ocorrem, no Brasil, na floresta pluvial costeira. Essas serpentes"
Questão 14298.   Biologia - Nível Superior - UFRN - BD - 2015,,"d) hormônios lipossolúveis com receptores no núcleo das células, podendo desencadear a ativação de fatores de transcrição gênica.",'d',"a) mediadores intercelulares, tais como a histamina produzida por mastócitos, que atua em células distantes do local da produção do mediador.",,"c) hormônios hidrossolúveis cujos receptores encontram-se no citoplasma, podendo determinar a liberação de cálcio.","b) mediadores químicos de ação local, tais como os hormônios corticosteroides, que são produzidos no córtex da glândula adrenal.",Uma das formas de comunicação entre as células de mamíferos se dá por meio de
Questão 6170.   Biologia - Nível Médio - Polícia Civil SP - VUNESP - 2012,e) a traqueia e os pulmões.,d) o palato e a orofaringe.,'a',a) a base da língua e a traqueia.,,c) a faringe e a epiglote.,b) a base da língua e o esôfago.,"A laringe é uma estrutura tubular, componente do sistema
respiratório, formada principalmente por músculos e cartilagens.
É correto afirmar que a laringe está localizada entre
"
Questão 28547.   Biologia - Nível Superior - Prefeitura de Aroeiras PB - ACAPLAM - 2010,e) Na leucopenia ocorre um aumento na produção para combater infecção.,d) Realizam fagocitose.,'e',"a) Dividem-se em agranulados,granulados e monócitos.",,c) São fabricados na medula óssea a partir de células hematopoiéticas.,b) A função do linfócito está relacionada com as reações imunitárias.,"Os leucócitos, também conhecidos por glóbulos brancos, são células produzidas na medula óssea e presentes no sangue, linfa, órgãos linfóides e vários tecidos conjuntivos. Um adulto normal possui entre 4 mil e 11 mil leucócitos por mililitro (milímetro cúbico) de sangue.

Sobre os leucócitos marque a alternativa errada:"
Questão 11457.   Biologia - Nível Superior - SAAE SP - VUNESP - 2014,"e) febre maculosa, febre tifoide, tuberculose e oxiuríase.","d) ascaridíase, cólera, esquistossomose e cisticercose.
",'d',"a) candidíase, filariose, amebíase e tripanossomíase.
",,"c) malária, febre amarela, dengue e leishmaniose.
","b) teníase, hanseníase, ancilostomose e giardíase.
","Doenças de caráter epidemiológico, as quais podem ser minimizadas e controladas por meio de implantação de infraestrutura adequada de saneamento básico e abastecimento de água tratada, são"
Questão 10146.   Biologia - Nível Superior - SEE AL - CESPE - 2013,,,'b',Certo,,,Errado,"A alfarroba é uma vagem da qual se extrai uma polpa que, depois de torrada e moída, pode ser usada como substituto do cacau. Com sabor de chocolate, os produtos feitos com alfarroba possuem o benefício de serem isentos de lactose, glúten e açúcar, embora, em termos calóricos, não apresentem muita diferença do cacau. A alfarrobeira (Ceratonia siliqua) também é designada pelo nome popular de figueira-do-egito.

Internet: < www.senado.gov.br/ > (com adaptações).

Com base nas informações apresentadas no texto e nos aspectos a ele relacionados, julgue os itens a seguir.

Não há centríolos nas células das folhas da alfarrobeira e, por isso, durante a mitose, essas células não passam pelo processo de citocinese."
Questão 16176.   Biologia - Nível Médio - Bombeiro Militar CE - CESPE - 2014,,,'a',Certo,,,Errado,"Com relação à fisiologia humana, julgue os itens de 114 a 117.

Além de proteger o organismo contra patógenos, a saliva lubrifica o alimento para facilitar a mastigação e a deglutição."
Questão 16527.   Biologia - Nível Médio - Bombeiro Militar MG - IDECAN - 2015,,"d) Mulheres grávidas, contaminadas pelo HIV, podem transmitir o vírus para o filho através da placenta, no momento  do parto ou na amamentação.",'b',"a) Uma vez incorporado, o DNA viral sofrerá duplicação juntamente com o DNA da célula hospedeira todas as vezes que  ela se dividir.",,"c) O HIV é um retrovírus envelopado, que, após uma fase inicial, pode ficar incubado por muitos anos sem que a pessoa  manifeste nenhum sintoma.","b) É considerada uma síndrome, pois se trata de um conjunto de sintomas relacionados à diminuição na quantidade de  linfócitos CD8.","A Aids,  ou  Síndrome  da  Imunodeficiência Adquirida,  é  uma  doença  sexualmente  transmissível  (DST)  causada  pelo  vírus HIV. Sobre essa doença, assinale a alternativa INCORRETA."
Questão 10132.   Biologia - Nível Superior - SEE AL - CESPE - 2013,,,'b',Certo,,,Errado,"Do ponto de vista metabólico, o cérebro humano é um órgão dispendioso, pois ele é o responsável por 20% do gasto total de energia, embora represente apenas 2% do peso total do corpo. A evolução para cérebros cada vez maiores é uma tendência marcante em toda a ordem dos primatas, o que culminou na espécie humana, cujo cérebro tem um volume desproporcional em relação ao tamanho do corpo.

F.M. Salzano. DNA: e eu com isso?
Oficina de textos, 2005 (com adaptações).

Tendo o texto acima como referência inicial e considerando os múltiplos aspectos que ele suscita, julgue os itens que se seguem.

De acordo com as propostas de Darwin, o aumento do cérebro dos primatas se deve às alterações genéticas no DNA das espécies e à subsequente seleção das variáveis mais aptas à sobrevivência."
Questão 25225.   Biologia - Nível Médio - UFF - UFF - 2010,"e) nucleotídeos de Timina, Citosina, Guanina, Uracila e Adenina; e DNA polimerase.","d) nucleotídeos de Timina, Citosina, Guanina e Uracila; e RNA polimerase.",'c',"a) nucleotídeos de Timina, Citosina, Guanina e Adenina; DNA e RNA polimerase.",,"c) nucleotídeos de Timina, Citosina, Guanina e Adenina; e DNA polimerase.","b) nucleotídeos de Timina, Citosina, Guanina e Uracila; e DNA polimerase.","Após o anúncio histórico da criação de vida artificial no laboratório do geneticista Craig Venter o mesmo responsável pela decodificação do genoma humano em 2001 , o presidente dos EUA, Barack Obama, pediu a seus conselheiros especializados em biotecnologia para analisarem as consequências e as implicações da nova técnica. (O Globo on line, 22/05/2010)
A experiência de Venter ainda não explica como a vida começou, mas reforça novamente que, sob determinadas condições, fragmentos químicos são unidos para formar a principal molécula responsável pelo código genético da vida.

Para a síntese de uma molécula de DNA em laboratório, a partir de uma fita molde de DNA, além do primer, deve-se utilizar"
Questão 11449.   Biologia - Nível Superior - SAAE SP - VUNESP - 2014,e) limnologia de comunidades zooplanctônicas.,d) zoologia de comunidades bentônicas.,'e',a) zoologia de comunidades nectônicas.,,c) ficologia de comunidades fitoplanctônicas.,b) limnologia de comunidades da ictiofauna.,"O título  Cladóceros fitófilos (Crustacea, Branchiopoda) do Parque Nacional das Emas, estado de Goiás  é de um artigo acadêmico publicado na revista científica Biota Neotropica, de janeiro/março em 2008.

A partir do título, é correto afirmar que se trata de um artigo referente à"
Questão 16180.   Biologia - Nível Médio - Bombeiro Militar CE - CESPE - 2014,,,'a',Certo,,,Errado," Nas próximas décadas, o clima brasileiro provavelmente será mais quente, com aumento gradativo e variável da temperatura média em todas as regiões do país (entre 1 ºC e 6 ºC até 2100), em comparação à média registrada no final do século XX. No mesmo período, está prevista a diminuição significativa da ocorrência de chuvas nas regiões Centro-Oeste, Norte e Nordeste do país. No entanto, haverá um aumento do número de precipitações nas regiões Sul e Sudeste. Entre essas conclusões, apresentadas no primeiro Relatório de Avaliação Nacional do Painel Brasileiro de Mudanças Climáticas (PBMC), constam, ainda, o aumento progressivo da temperatura da caatinga (entre 3,5 ºC e 4,5 ºC) e a diminuição da ocorrência de chuvas nesse bioma (entre 40% e 50%).

Internet: (com adaptações).

Tendo o texto acima como referência inicial, julgue os próximos itens.

A alternância entre uma paisagem de aspecto árido e uma vegetação verde e florida é típica do bioma citado no texto."
Questão 10137.   Biologia - Nível Superior - SEE AL - CESPE - 2013,,,'a',Certo,,,Errado,"Em 1977, o cientista norte-americano Carl Woese revolucionou a árvore da vida, diagrama que representa a relação evolutiva entre as espécies, ao propor um novo domínio, os Archaea. Pensava-se que esse conjunto de espécies eram bactérias, mas C. Woese mostrou que é um grupo independente e, a nível evolutivo, tão próximo da bactéria Escherichia coli como de um cogumelo ou de um pinguim. C. Woese considerou, em seus estudos, o sequenciamento do RNA ribossomal dos seres vivos.

Internet: < www.publico.pt > (com adaptações).

Com base no texto acima, julgue os próximos itens.

A proposta de Carl Woese possibilitou a organização da diversidade biológica nos domínios Eucarya, Archaea e Bacteria."
Questão 10143.   Biologia - Nível Superior - SEE AL - CESPE - 2013,,,'a',Certo,,,Errado,"O Grupo de Comunidades Bentônicas, da Universidade Federal de Alagoas, identificou organismos da fauna de invertebrados considerados, atualmente, endêmicos das áreas de recife brasileiras e novas espécies, cuja localidade-tipo é o litoral de Alagoas. Entre elas constam a esponja Mycale alagoana e os briozoários Vasigynella ovicellata, Beania correiae, Bugula alba, Bugula bowiei e Bugula gnoma. Briozoários são pequenos animais invertebrados que formam colônias em pedras e sedimentos no mar. A coordenadora da pesquisa destaca que, mesmo após duas décadas de estudos, apenas 50% da fauna dos invertebrados nos ecossistemas recifais foi identificada, o que comprova a vastidão da biodiversidade marinha em Alagoas. De acordo com a coordenadora, os principais invertebrados presentes nos recifes são esponjas, corais, moluscos, poliquetas, crustáceos, briozoários, equinodermos e ascídias. Internet:

< www.alagoas24horas.com.br > (com adaptações).

Considerando as informações apresentadas no texto acima, julgue os itens subsequentes.

Espécies que compartilham o mesmo gênero necessariamente compartilham a mesma ordem e a mesma classe."
Questão 10098.   Biologia - Nível Médio - SEE AC - FUNCAB - 2010,"e) A epidemia de cólera não é tão fácil de acontecer, pois a doença é transmitida de humano para humano, levando algum tempo para que o processo se instale.",d) Tanto a cólera quanto a leptospirose são doenças endêmicas da região.,'c',"a) A chuva é fator determinante para a proliferação das duas doenças, pois emambos os casos arrasta a urina do rato, que é o vetor, espalhando as bactérias por diversos ambientes.",,c) A falta de rede de esgoto em alguns locais da região é fator importante para que haja uma epidemia de cólera.,"b) Na região Zona da Mata Sul, relatada no texto, a cólera aparece esporadicamente, apenas em momentos em que há muita chuva.","Nordeste já sofre com epidemias causadas pela chuva.
Um surto de diarreia em Maraial, na Zona da Mata Sul, a 133 quilômetros do Recife, acendeu o alerta entre autoridades de saúde que monitoram municípios afetados pelas enchentes que já mataram 52 pessoas e deixaram 157,5 mil sem casa em Pernambuco e Alagoas. Elas temem uma onda de epidemias, como leptospirose e cólera, cujos sintomas levam ao menos uma semana para aparecer (...).

(...) O temor e a supervisão redobrada das autoridades em relação à manifestação de sintomas de doenças epidêmicas ainda é motivado pelo fato de a cólera ser endêmica na região da Zona da Mata Sul.O bacilo foi controlado somente nos anos 1980 em Cortês, município vizinho a Palmares. Mas, como é resistente, pode voltar a se proliferar em condições ambientais e sanitárias propícias para o contágio, que ocorre principalmente quando há carência de rede de esgoto e de água potável.(O Estado de S.Paulo. 26/06/2010)

A reportagem acima, extraída do Jornal O Estado de São Paulo, relata uma situação que normalmente acontece em locais onde houve um grande volume de chuvas. A respeito do que foi citado na reportagem, assinale a alternativa que está correta."
Questão 11446.   Biologia - Nível Superior - SAAE SP - VUNESP - 2014,"e) utilizar a energia luminosa ou química, a partir da poli­merização de biomoléculas.","d) degradar moléculas orgânicas, a partir de reações ana­bolizantes.
",'a',"a) sintetizar moléculas orgânicas, a partir de minerais e gases obtidos no ambiente.
",,"c) produzir moléculas orgânicas, a partir de reações cata­bolizantes.
","b) transformar a energia luminosa em energia química, a partir de reações exotérmicas.
",O termo autotrófico corresponde aos organismos capazes de
Questão 11445.   Biologia - Nível Superior - SAAE SP - VUNESP - 2014,"e) apenas o envoltório nuclear dos eucariontes, observado em alguns procariontes.","d) apenas as organelas citoplasmáticas dos eucariontes, observado em alguns procariontes.
",'c',"a) as membranas das organelas citoplasmáticas e o envol­tório nuclear dos eucariontes, não sendo observado nos procariontes.",,"c) as membranas internas citoplasmáticas, sendo observado em alguns procariontes, como as cianofíceas.
","b) apenas o envoltório nuclear dos eucariontes, não sendo observado nos procariontes.
","Com relação ao sistema endomembranoso das células, é correto afirmar que constitui"
Questão 25122.   Biologia - Nível Médio - USP - FUVEST - 2015,"e) corpo não segmentado, esqueleto corporal externo e excreção por túbulos de malpighi.","d) corpo não segmentado, apêndices articulados e respiração traqueal.",'b',"a) simetria bilateral, respiração traqueal e excreção por túbulos de malpighi.",,"c) presença de cefalotórax, sistema digestório incompleto e circulação aberta.","b) simetria bilateral, esqueleto corporal externo e apêndices articulados.","Tatuzinhos-de-jardim, escorpiões, siris, centopeias e borboletas são todos artrópodes. Compartilham, portanto, as seguintes características:"
Questão 28542.   Biologia - Nível Superior - Prefeitura de Aroeiras PB - ACAPLAM - 2010,e) Células de companhia é outro tipo celular que constitui o floema.,d) As fibras liberinas são células mortas do floema e exercem funções de suporte.,'a',"a) A seiva elaborada é transportada em direção única, da mesma forma do xilema.",,c) As células do parênquima liberino exercem funções de reserva.,b) Célula crivosa faz parte da constituição celular.,"Sobre floema, marque a alternativa errada:"
Questão 10142.   Biologia - Nível Superior - SEE AL - CESPE - 2013,,,'a',Certo,,,Errado,"O Grupo de Comunidades Bentônicas, da Universidade Federal de Alagoas, identificou organismos da fauna de invertebrados considerados, atualmente, endêmicos das áreas de recife brasileiras e novas espécies, cuja localidade-tipo é o litoral de Alagoas. Entre elas constam a esponja Mycale alagoana e os briozoários Vasigynella ovicellata, Beania correiae, Bugula alba, Bugula bowiei e Bugula gnoma. Briozoários são pequenos animais invertebrados que formam colônias em pedras e sedimentos no mar. A coordenadora da pesquisa destaca que, mesmo após duas décadas de estudos, apenas 50% da fauna dos invertebrados nos ecossistemas recifais foi identificada, o que comprova a vastidão da biodiversidade marinha em Alagoas. De acordo com a coordenadora, os principais invertebrados presentes nos recifes são esponjas, corais, moluscos, poliquetas, crustáceos, briozoários, equinodermos e ascídias. Internet:

< www.alagoas24horas.com.br > (com adaptações).

Considerando as informações apresentadas no texto acima, julgue os itens subsequentes.

No texto, são citadas cinco espécies de briozoários, que estão distribuídas em três gêneros distintos."
Questão 14295.   Biologia - Nível Superior - UFRN - BD - 2015,,d) excesso de vacúolos nas procariontes.,'c',a) ausência de parede celular nas eucariontes.,,c) abundância de membranas nas eucariontes.,b) presença de citoesqueleto nas procariontes.,"Na comparação entre células procariontes e eucariontes, observa-se"
Questão 16527.   Biologia - Nível Médio - Bombeiro Militar MG - IDECAN - 2015,,"d) Mulheres grávidas, contaminadas pelo HIV, podem transmitir o vírus para o filho através da placenta, no momento  do parto ou na amamentação.",'b',"a) Uma vez incorporado, o DNA viral sofrerá duplicação juntamente com o DNA da célula hospedeira todas as vezes que  ela se dividir.",,"c) O HIV é um retrovírus envelopado, que, após uma fase inicial, pode ficar incubado por muitos anos sem que a pessoa  manifeste nenhum sintoma.","b) É considerada uma síndrome, pois se trata de um conjunto de sintomas relacionados à diminuição na quantidade de  linfócitos CD8.","A Aids,  ou  Síndrome  da  Imunodeficiência Adquirida,  é  uma  doença  sexualmente  transmissível  (DST)  causada  pelo  vírus HIV. Sobre essa doença, assinale a alternativa INCORRETA."
Questão 11445.   Biologia - Nível Superior - SAAE SP - VUNESP - 2014,"e) apenas o envoltório nuclear dos eucariontes, observado em alguns procariontes.","d) apenas as organelas citoplasmáticas dos eucariontes, observado em alguns procariontes.
",'c',"a) as membranas das organelas citoplasmáticas e o envol­tório nuclear dos eucariontes, não sendo observado nos procariontes.",,"c) as membranas internas citoplasmáticas, sendo observado em alguns procariontes, como as cianofíceas.
","b) apenas o envoltório nuclear dos eucariontes, não sendo observado nos procariontes.
","Com relação ao sistema endomembranoso das células, é correto afirmar que constitui"
Questão 14301.   Biologia - Nível Superior - UFRN - BD - 2015,,"d) o acréscimo de um trecho de nucleotídeos adenina à extremidade 5, evento este chamado poliadenilação.",'b',"a) o evento de clivagem e remoção dos éxons e união dos íntros, por parte dos spliceossomos.",,"c) a adição de um cap constituído de 7-metilguanosina na extremidade 3, para proteger o transcrito da degradação.","b) a atração do cerne da enzima RNA polimerase II pelos fatores de transcrição, para iniciar o processo.","Na transcrição do RNA mensageiro, em eucariotos, ocorre"
